{
    "$schema": "../wall-schema.json",
    "width": 1200,
    "height": 800,
    "holds": [
        {
            "id": "h1",
            "x": 100,
            "y": 50,
            "type": "jug"
        },
        {
            "id": "h2",
            "x": 150,
            "y": 100,
            "type": "crimp"
        },
        {
            "id": "h3",
            "x": 200,
            "y": 150,
            "type": "sloper"
        },
        {
            "id": "h4",
            "x": 225,
            "y": 200,
            "type": "pocket"
        },
        {
            "id": "h5",
            "x": 175,
            "y": 250,
            "type": "pinch"
        },
        {
            "id": "h6",
            "x": 100,
            "y": 300,
            "type": "crimp"
        }
    ],
    "route": [
        "h1",
        "h2",
        "h3",
        "h4",
        "h5",
        "h6",
        "h6"
    ]
}