{
    "$schema": "./wall-schema.json",
    "width": 1200,
    "height": 800,
    "holds": [
        {
            "id": "h1",
            "x": 150,
            "y": 750,
            "type": "jug"
        },
        {
            "id": "h2",
            "x": 150,
            "y": 600,
            "type": "crimp"
        },
        {
            "id": "h3",
            "x": 400,
            "y": 550,
            "type": "jug"
        },
        {
            "id": "h4",
            "x": 350,
            "y": 400,
            "type": "crimp"
        },
        {
            "id": "h5",
            "x": 300,
            "y": 175,
            "type": "crimp"
        },
        {
            "id": "h6",
            "x": 325,
            "y": 50,
            "type": "crimp"
        }
    ],
    "route": [
        "h1",
        "h2",
        "h3",
        "h4",
        "h5",
        "h6",
        "h6"
    ]
}